
T:  Bus=05 Lev=00 Prnt=00 Port=00 Cnt=00 Dev#=  1 Spd=480 MxCh= 2
D:  Ver= 2.00 Cls=09(hub  ) Sub=00 Prot=01 MxPS=64 #Cfgs=  1
P:  Vendor=1d6b ProdID=0002 Rev=03.18
S:  Manufacturer=Linux 3.18.10-1-MANJARO xhci-hcd
S:  Product=xHCI Host Controller
S:  SerialNumber=0000:04:00.0
C:  #Ifs= 1 Cfg#= 1 Atr=e0 MxPwr=0mA
I:  If#= 0 Alt= 0 #EPs= 1 Cls=09(hub  ) Sub=00 Prot=00 Driver=hub


T:  Bus=05 Lev=01 Prnt=01 Port=00 Cnt=01 Dev#=  2 Spd=480 MxCh= 4
D:  Ver= 2.00 Cls=09(hub  ) Sub=00 Prot=02 MxPS=64 #Cfgs=  1
P:  Vendor=05e3 ProdID=0614 Rev=01.97
S:  Product=USB2.0 Hub Charger
C:  #Ifs= 1 Cfg#= 1 Atr=e0 MxPwr=100mA
I:  If#= 0 Alt= 1 #EPs= 1 Cls=09(hub  ) Sub=00 Prot=02 Driver=hub

T:  Bus=05 Lev=02 Prnt=02 Port=00 Cnt=01 Dev#=  3 Spd=1.5 MxCh= 0
D:  Ver= 1.10 Cls=00(>ifc ) Sub=00 Prot=00 MxPS= 8 #Cfgs=  1
P:  Vendor=1c4f ProdID=0016 Rev=01.10
S:  Manufacturer=SIGMACH1P
S:  Product=USB Keyboard
C:  #Ifs= 2 Cfg#= 1 Atr=a0 MxPwr=98mA
I:  If#= 0 Alt= 0 #EPs= 1 Cls=03(HID  ) Sub=01 Prot=01 Driver=usbhid
I:  If#= 1 Alt= 0 #EPs= 1 Cls=03(HID  ) Sub=00 Prot=00 Driver=usbhid

T:  Bus=05 Lev=02 Prnt=02 Port=01 Cnt=02 Dev#=  4 Spd=480 MxCh= 4
D:  Ver= 2.00 Cls=09(hub  ) Sub=00 Prot=01 MxPS=64 #Cfgs=  1
P:  Vendor=05e3 ProdID=0608 Rev=77.64
S:  Product=USB2.0 Hub
C:  #Ifs= 1 Cfg#= 1 Atr=e0 MxPwr=100mA
I:  If#= 0 Alt= 0 #EPs= 1 Cls=09(hub  ) Sub=00 Prot=00 Driver=hub

T:  Bus=05 Lev=03 Prnt=04 Port=00 Cnt=01 Dev#=  6 Spd=1.5 MxCh= 0
D:  Ver= 1.10 Cls=00(>ifc ) Sub=00 Prot=00 MxPS= 8 #Cfgs=  1
P:  Vendor=04d9 ProdID=2819 Rev=01.01
C:  #Ifs= 2 Cfg#= 1 Atr=a0 MxPwr=100mA
I:  If#= 0 Alt= 0 #EPs= 1 Cls=03(HID  ) Sub=01 Prot=01 Driver=usbhid
I:  If#= 1 Alt= 0 #EPs= 1 Cls=03(HID  ) Sub=01 Prot=00 Driver=usbhid

T:  Bus=05 Lev=02 Prnt=02 Port=03 Cnt=03 Dev#=  9 Spd=1.5 MxCh= 0
D:  Ver= 1.10 Cls=00(>ifc ) Sub=00 Prot=00 MxPS= 8 #Cfgs=  1
P:  Vendor=1c4f ProdID=0016 Rev=01.10
S:  Manufacturer=SIGMACH1P
S:  Product=USB Keyboard
C:  #Ifs= 2 Cfg#= 1 Atr=a0 MxPwr=98mA
I:  If#= 0 Alt= 0 #EPs= 1 Cls=03(HID  ) Sub=01 Prot=01 Driver=usbhid
I:  If#= 1 Alt= 0 #EPs= 1 Cls=03(HID  ) Sub=00 Prot=00 Driver=usbhid
